{
  "schemaVersion": "1.0.0",
  "updatedAt": "2026-10-25T15:58:41Z",
  "statusVocabulary": [
    "VERIFIED",
    "PARTIALLY VERIFIED",
    "NOT VERIFIED",
    "DEGRADED",
    "NOT OBSERVABLE"
  ],
  "capabilities": [
    {
      "id": "worker.neural-route-contract",
      "title": "GLORIFIER Worker Neural route contract",
      "boundary": "GLORIFIER control plane to the separately deployed GLORIFIER-NEURAL execution plane",
      "scope": "mocked-contract-test",
      "status": "PARTIALLY VERIFIED",
      "targetEnvironments": [
        "Mocked Worker test harness",
        "CircleCI Linux Docker executor"
      ],
      "evidence": [
        {
          "kind": "automated-test",
          "reference": "src/worker.test.ts",
          "targetEnvironment": "Mocked Worker runtime; no live Neural origin",
          "observedAt": null,
          "notes": "Contract tests cover explicit routes, auth failure, origin validation, timeout mapping, readiness status, and upstream cookie non-forwarding."
        },
        {
          "kind": "ci-run",
          "reference": "https://circleci.com/gh/GLORIFIER7/GLORIFIER/225",
          "targetEnvironment": "main commit 51e41003f5c1e3883cf3c834eaad5a1f80079ac2; cimg/node:24.16.0 Linux Docker executor",
          "observedAt": "2026-10-25T13:17:49.628Z",
          "notes": "This historical green run covered npm ci, lint/type-check, Worker tests, frontend build, and output check before this branch's body-limit changes; it is not evidence of live Neural readiness."
        },
        {
          "kind": "ci-run",
          "reference": "https://github.com/GLORIFIER7/GLORIFIER/actions/runs/40198249420/job/121183678228",
          "targetEnvironment": "GitHub-hosted Ubuntu 22.04 x86_64, commit 44a976ee0b2b2ec156da6429e36dbfaf68c6d747",
          "observedAt": "2026-10-25T13:35:14Z",
          "notes": "Successful source matrix job ran registry validation, TypeScript type-check, Worker regression tests, separate Ethereum/BNB/Solana read-only verifier test vectors, frontend build and static output verification."
        },
        {
          "kind": "ci-run",
          "reference": "https://github.com/GLORIFIER7/GLORIFIER/actions/runs/40198249420/job/121183678338",
          "targetEnvironment": "GitHub-hosted Ubuntu 24.04 x86_64, commit 44a976ee0b2b2ec156da6429e36dbfaf68c6d747",
          "observedAt": "2026-10-25T13:35:22Z",
          "notes": "Successful source matrix job ran registry validation, TypeScript type-check, Worker regression tests, separate Ethereum/BNB/Solana read-only verifier test vectors, frontend build and static output verification."
        }
      ],
      "limitations": [
        "The upstream is mocked in unit tests.",
        "The new request-body limit tests in this branch still require a green run.",
        "No live staging or production Neural origin has been probed."
      ]
    },
    {
      "id": "worker.neural-task-request-boundary",
      "title": "Neural task JSON media type and request-size boundary",
      "boundary": "Public Worker POST /api/neural/v1/tasks",
      "scope": "request-validation-and-body-size-limit",
      "status": "PARTIALLY VERIFIED",
      "targetEnvironments": [
        "Mocked Worker unit tests",
        "Cloudflare Worker runtime after reviewed rollout"
      ],
      "evidence": [
        {
          "kind": "automated-test",
          "reference": "src/worker.test.ts",
          "targetEnvironment": "Branch test harness; CI pending for this change",
          "observedAt": null,
          "notes": "Tests are added for unsupported media type, declared oversized content length, and actual oversized request bodies without trusting Content-Length."
        },
        {
          "kind": "source",
          "reference": "src/worker.ts",
          "targetEnvironment": "Repository branch fix/issue-471-interoperability-hardening",
          "observedAt": null,
          "notes": "Implementation caps buffered task bodies at 65,536 bytes (64 KiB), matching Neural, accepts JSON media types, and rejects oversized bodies with HTTP 413."
        },
        {
          "kind": "ci-run",
          "reference": "https://github.com/GLORIFIER7/GLORIFIER/actions/runs/40198249420/job/121183678228",
          "targetEnvironment": "GitHub-hosted Ubuntu 22.04 x86_64, commit 44a976ee0b2b2ec156da6429e36dbfaf68c6d747",
          "observedAt": "2026-10-25T13:35:14Z",
          "notes": "Successful source matrix job ran registry validation, TypeScript type-check, Worker regression tests, separate Ethereum/BNB/Solana read-only verifier test vectors, frontend build and static output verification."
        },
        {
          "kind": "ci-run",
          "reference": "https://github.com/GLORIFIER7/GLORIFIER/actions/runs/40198249420/job/121183678338",
          "targetEnvironment": "GitHub-hosted Ubuntu 24.04 x86_64, commit 44a976ee0b2b2ec156da6429e36dbfaf68c6d747",
          "observedAt": "2026-10-25T13:35:22Z",
          "notes": "Successful source matrix job ran registry validation, TypeScript type-check, Worker regression tests, separate Ethereum/BNB/Solana read-only verifier test vectors, frontend build and static output verification."
        }
      ],
      "limitations": [
        "Do not treat this capability as verified until the branch CI completes successfully.",
        "No production configuration or deployment is performed by this change."
      ]
    },
    {
      "id": "neural.runtime-live-readiness",
      "title": "Live GLORIFIER-NEURAL health and readiness",
      "boundary": "Configured HTTPS origin from Worker to Neural service",
      "scope": "live-runtime-probe",
      "status": "NOT OBSERVABLE",
      "targetEnvironments": [
        "Staging",
        "Production"
      ],
      "evidence": [
        {
          "kind": "documentation",
          "reference": "docs/architecture/neural-engine-integration.md#current-evidence",
          "targetEnvironment": "Staging and production",
          "observedAt": null,
          "notes": "Repository documentation explicitly distinguishes the adapter implementation from evidence of a reachable deployed Neural origin."
        }
      ],
      "limitations": [
        "No verified GLORIFIER_NEURAL_ORIGIN or authorized live probe was provided.",
        "The Worker adapter must remain unavailable when its origin is missing or invalid.",
        "Provider readiness is not implied by process health."
      ]
    },
    {
      "id": "linux.source-runtime-matrix",
      "title": "Node.js source checks on supported Ubuntu CI targets",
      "boundary": "Source build, Worker tests, type-check and static output",
      "scope": "linux-source-ci",
      "status": "VERIFIED",
      "targetEnvironments": [
        "GitHub-hosted ubuntu-22.04 x86_64",
        "GitHub-hosted ubuntu-24.04 x86_64"
      ],
      "evidence": [
        {
          "kind": "ci-run",
          "reference": ".github/workflows/interoperability-linux.yml",
          "targetEnvironment": "Ubuntu 22.04 and 24.04 x86_64; Node version from .node-version",
          "observedAt": null,
          "notes": "The new workflow defines this test matrix; results are pending a successful workflow run."
        },
        {
          "kind": "ci-run",
          "reference": "https://github.com/GLORIFIER7/GLORIFIER/actions/runs/40198249420/job/121183678228",
          "targetEnvironment": "GitHub-hosted Ubuntu 22.04 x86_64, commit 44a976ee0b2b2ec156da6429e36dbfaf68c6d747",
          "observedAt": "2026-10-25T13:35:14Z",
          "notes": "Successful source matrix job ran registry validation, TypeScript type-check, Worker regression tests, separate Ethereum/BNB/Solana read-only verifier test vectors, frontend build and static output verification."
        },
        {
          "kind": "ci-run",
          "reference": "https://github.com/GLORIFIER7/GLORIFIER/actions/runs/40198249420/job/121183678338",
          "targetEnvironment": "GitHub-hosted Ubuntu 24.04 x86_64, commit 44a976ee0b2b2ec156da6429e36dbfaf68c6d747",
          "observedAt": "2026-10-25T13:35:22Z",
          "notes": "Successful source matrix job ran registry validation, TypeScript type-check, Worker regression tests, separate Ethereum/BNB/Solana read-only verifier test vectors, frontend build and static output verification."
        },
        {
          "kind": "ci-run",
          "reference": "https://github.com/GLORIFIER7/GLORIFIER/actions/runs/40209200837",
          "targetEnvironment": "GitHub-hosted Ubuntu 22.04 and Ubuntu 24.04 x86_64; exact tested commit 3eecd2613c066eb1a0c3fce4573900538f48670a",
          "observedAt": "2026-10-25T15:58:41Z",
          "notes": "Observed completed Interoperability Linux validation run #42 on the exact tested branch commit: both source-matrix jobs passed capability-registry validation, TypeScript type-check, Worker/interoperability boundary tests, chain-specific read-only verifier fixtures, frontend build, and static output verification. This verifies only the named source CI targets."
        }
      ],
      "limitations": [
        "Verification is limited to GitHub-hosted Ubuntu 22.04 and Ubuntu 24.04 x86_64; no Linux ARM64, Alpine, other-distribution, Windows, or macOS claim is made.",
        "Source CI does not establish live GLORIFIER-NEURAL/provider readiness or real EVM/BNB/Solana RPC reachability.",
        "No production deployment was performed as part of this verification."
      ]
    },
    {
      "id": "linux.container-builds",
      "title": "Container image builds",
      "boundary": "OCI images defined by Dockerfile and Dockerfile.ubuntu",
      "scope": "container-build",
      "status": "VERIFIED",
      "targetEnvironments": [
        "GitHub-hosted Ubuntu 24.04 x86_64 Docker builder",
        "Distroless Node.js 22 runtime image on the GitHub-hosted Ubuntu 24.04 x86_64 runner",
        "Ubuntu 24.04 runtime image on the GitHub-hosted Ubuntu 24.04 x86_64 runner"
      ],
      "evidence": [